,Player,Team,Game,Date,Opposing Team,Position,Team Type,Pre-Season Injury?,Winning Team?,Week of Injury,Season,Weeks Injured,Games Missed,Unknown Injury?,Reported Injury Type,Total Snaps,Play Time After Injury,Average Playtime Before Injury
0,Aldrick Robinson,Washington Redskins,Washington Redskins vs. Tampa Bay Buccaneers (30/9/2012),30/09/2012,Tampa Bay Buccaneers,Wide Receiver,offense,No,Yes,4,2012,1,1.0,No,Head,0,14 downs,37.00 downs
1,D.J. Fluker,San Diego Chargers,Tennessee Titans vs. San Diego Chargers (22/9/2013),22/09/2013,Tennessee Titans,Offensive Tackle,offense,No,No,3,2013,1,1.0,No,Concussion,0,78 downs,73.50 downs
2,Marquise Goodwin,Buffalo Bills,Houston Texans vs. Buffalo Bills (28/9/2014),28/09/2014,Houston Texans,Wide Receiver,offense,No,No,4,2014,1,1.0,No,Concussion,0,25 downs,17.50 downs
3,Bryan Stork,New England Patriots,New England Patriots vs. Buffalo Bills (12/10/2014),12/10/2014,Buffalo Bills,Center,offense,No,Yes,6,2014,1,1.0,No,Head,0,82 downs,41.50 downs
4,Daniel Kilgore,San Francisco 49ers,San Francisco 49ers vs. Arizona Cardinals (29/10/2012),29/10/2012,Arizona Cardinals,Guard,offense,No,Yes,8,2012,1,0.0,No,Concussion,1,8 downs,14.43 downs
5,Dennis Pitta,Baltimore Ravens,Baltimore Ravens vs. Pittsburgh Steelers (18/11/2012),18/11/2012,Pittsburgh Steelers,Tight End,offense,No,Yes,11,2012,1,0.0,No,Head,1,85 downs,46.44 downs
6,Shea McClellin,Chicago Bears,Houston Texans vs. Chicago Bears (11/11/2012),11/11/2012,Houston Texans,Defensive End,defense,No,No,10,2012,1,1.0,No,Concussion,1,27 downs,31.00 downs
7,Brent Celek,Philadelphia Eagles,Philadelphia Eagles vs. Tampa Bay Buccaneers (9/12/2012),9/12/2012,Tampa Bay Buccaneers,Tight End,offense,No,Yes,14,2012,1,1.0,No,Concussion,1,64 downs,66.50 downs
8,Johnathan Franklin,Green Bay Packers,Minnesota Vikings vs. Green Bay Packers (24/11/2013),24/11/2013,Minnesota Vikings,Running Back,offense,No,No,12,2013,1,5.0,No,Concussion,1,Did not return from injury,13.90 downs
9,Stephen Hill,New York Jets,Tennessee Titans vs. New York Jets (29/9/2013),29/09/2013,Tennessee Titans,Wide Receiver,offense,No,No,4,2013,1,0.0,No,Concussion,2,31 downs,69.67 downs
10,Joe Webb,Minnesota Vikings,Minnesota Vikings vs. Green Bay Packers (24/11/2013),24/11/2013,Green Bay Packers,Wide Receiver,offense,No,Yes,12,2013,1,0.0,No,Concussion,2,6 downs,22.90 downs
11,Jeff Maehl,Philadelphia Eagles,Philadelphia Eagles vs. Arizona Cardinals (1/12/2013),1/12/2013,Arizona Cardinals,Wide Receiver,offense,No,Yes,13,2013,1,0.0,No,Concussion,2,6 downs,14.18 downs
12,Steve Vallos,Denver Broncos,Denver Broncos vs. Houston Texans (22/12/2013),22/12/2013,Houston Texans,Center,offense,No,Yes,16,2013,1,1.0,No,Concussion,2,7 downs,8.14 downs
13,Dwight Lowery,Jacksonville Jaguars,Seattle Seahawks vs. Jacksonville Jaguars (22/9/2013),22/09/2013,Seattle Seahawks,Safety,defense,No,No,3,2013,1,13.0,No,Concussion,2,Did not return from injury,62.50 downs
14,Ryan Mathews,San Diego Chargers,Oakland Raiders vs. San Diego Chargers (6/10/2013),6/10/2013,Oakland Raiders,Running Back,offense,No,No,5,2013,1,0.0,No,Concussion,3,40 downs,25.25 downs
15,Darren Sproles,New Orleans Saints,New York Jets vs. New Orleans Saints (3/11/2013),3/11/2013,New York Jets,Running Back,offense,No,No,9,2013,1,0.0,No,Concussion,3,37 downs,31.88 downs
16,Joe Reitz,Indianapolis Colts,Indianapolis Colts vs. Detroit Lions (2/12/2012),2/12/2012,Detroit Lions,Guard,offense,No,Yes,13,2012,1,1.0,No,Head,3,64 downs,66.20 downs
17,Theo Riddick,Detroit Lions,Green Bay Packers vs. Detroit Lions (6/10/2013),6/10/2013,Green Bay Packers,Running Back,offense,No,No,5,2013,1,2.0,No,Concussion,3,20 downs,22.50 downs
18,William Middleton,Jacksonville Jaguars,Houston Texans vs. Jacksonville Jaguars (18/11/2012),18/11/2012,Houston Texans,Cornerback,defense,No,No,11,2012,1,6.0,No,Concussion,3,Did not return from injury,28.67 downs
19,Johnny White,Green Bay Packers,New York Giants vs. Green Bay Packers (25/11/2012),25/11/2012,New York Giants,Running Back,offense,No,No,12,2012,1,7.0,No,Concussion,3,Did not return from injury,12.33 downs
20,Andre Brown,New York Giants,New York Giants vs. Cleveland Browns (7/10/2012),7/10/2012,Cleveland Browns,Running Back,offense,No,Yes,5,2012,1,1.0,No,Concussion,4,25 downs,36.25 downs
21,K.J. Wright,Seattle Seahawks,Seattle Seahawks vs. Minnesota Vikings (4/11/2012),4/11/2012,Minnesota Vikings,Linebacker,defense,No,Yes,9,2012,1,1.0,No,Concussion,4,71 downs,73.75 downs
22,Reggie Walker,Arizona Cardinals,St. Louis Rams vs. Arizona Cardinals (4/10/2012),4/10/2012,St. Louis Rams,Linebacker,defense,No,No,5,2012,1,2.0,No,Head,4,20 downs,28.75 downs
23,Tracy Porter,Denver Broncos,Denver Broncos vs. Cleveland Browns (23/12/2012),23/12/2012,Cleveland Browns,Cornerback,defense,No,Yes,16,2012,1,2.0,No,Concussion,4,Did not return from injury,63.80 downs
24,Laurent Robinson,Jacksonville Jaguars,Jacksonville Jaguars vs. Indianapolis Colts (23/9/2012),23/09/2012,Indianapolis Colts,Wide Receiver,offense,No,Yes,3,2012,1,0.0,No,Concussion,5,26 downs,56.00 downs
25,Omar Bolden,Denver Broncos,Denver Broncos vs. San Diego Chargers (18/11/2012),18/11/2012,San Diego Chargers,Cornerback,defense,No,Yes,11,2012,1,0.0,No,Concussion,5,12 downs,22.67 downs
26,Isaac Redman,Pittsburgh Steelers,Baltimore Ravens vs. Pittsburgh Steelers (18/11/2012),18/11/2012,Baltimore Ravens,Running Back,offense,No,No,11,2012,1,0.0,No,Concussion,5,5 downs,28.86 downs
27,Domenik Hixon,New York Giants,New York Giants vs. Tampa Bay Buccaneers (16/9/2012),16/09/2012,Tampa Bay Buccaneers,Wide Receiver,offense,No,Yes,2,2012,1,1.0,No,Concussion,5,62 downs,29.00 downs
28,Eddie Lacy,Green Bay Packers,Green Bay Packers vs. Washington Redskins (15/9/2013),15/09/2013,Washington Redskins,Running Back,offense,No,Yes,2,2013,1,1.0,No,Concussion,5,54 downs,41.00 downs
29,LaRon Byrd,Arizona Cardinals,St. Louis Rams vs. Arizona Cardinals (25/11/2012),25/11/2012,St. Louis Rams,Wide Receiver,offense,No,No,12,2012,1,2.0,No,Head,5,20 downs,1.00 downs
30,Bernard Pierce,Baltimore Ravens,Denver Broncos vs. Baltimore Ravens (16/12/2012),16/12/2012,Denver Broncos,Running Back,offense,No,No,15,2012,1,0.0,No,Head,6,22 downs,12.69 downs
31,Dunta Robinson,Atlanta Falcons,Tampa Bay Buccaneers vs. Atlanta Falcons (30/12/2012),30/12/2012,Tampa Bay Buccaneers,Cornerback,defense,No,No,17,2012,1,0.0,No,Head,6,63 downs,62.00 downs
32,Raymond Ventrone,San Francisco 49ers,Indianapolis Colts vs. San Francisco 49ers (22/9/2013),22/09/2013,Indianapolis Colts,Safety,defense,No,No,3,2013,1,0.0,No,Concussion,6,25 downs,20.00 downs
33,Jermichael Finley,Green Bay Packers,Cincinnati Bengals vs. Green Bay Packers (22/9/2013),22/09/2013,Cincinnati Bengals,Tight End,offense,No,No,3,2013,1,0.0,No,Concussion,6,45 downs,51.00 downs
34,Nolan Carroll,Miami Dolphins,Miami Dolphins vs. Cincinnati Bengals (31/10/2013),31/10/2013,Cincinnati Bengals,Cornerback,defense,No,Yes,9,2013,1,0.0,No,Concussion,6,73 downs,58.86 downs
35,Ellis Lankster,New York Jets,San Diego Chargers vs. New York Jets (23/12/2012),23/12/2012,San Diego Chargers,Cornerback,defense,No,No,16,2012,1,1.0,No,Concussion,6,Did not return from injury,41.14 downs
36,Billy Winn,Cleveland Browns,Cincinnati Bengals vs. Cleveland Browns (16/9/2012),16/09/2012,Cincinnati Bengals,Defensive Tackle,defense,No,No,2,2012,1,0.0,No,Head,7,56 downs,69.00 downs
37,Kyle Arrington,New England Patriots,New England Patriots vs. St. Louis Rams (28/10/2012),28/10/2012,St. Louis Rams,Cornerback,defense,No,Yes,8,2012,1,0.0,No,Concussion,7,86 downs,74.29 downs
38,Ernie Sims,Dallas Cowboys,Dallas Cowboys vs. Pittsburgh Steelers (16/12/2012),16/12/2012,Pittsburgh Steelers,Linebacker,defense,No,Yes,15,2012,1,0.0,No,Concussion,7,20 downs,54.43 downs
39,Justin Bethel,Arizona Cardinals,Arizona Cardinals vs. Jacksonville Jaguars (17/11/2013),17/11/2013,Jacksonville Jaguars,Cornerback,defense,No,Yes,11,2013,1,0.0,No,Concussion,7,17 downs,21.22 downs
40,Antoine Caldwell,Houston Texans,Green Bay Packers vs. Houston Texans (14/10/2012),14/10/2012,Green Bay Packers,Guard,offense,No,No,6,2012,1,0.0,No,Concussion,8,48 downs,48.00 downs
41,Craig Stevens,Tennessee Titans,Tennessee Titans vs. Oakland Raiders (24/11/2013),24/11/2013,Oakland Raiders,Tight End,offense,No,Yes,12,2013,1,1.0,No,Concussion,8,15 downs,43.90 downs
42,Dre Kirkpatrick,Cincinnati Bengals,Cincinnati Bengals vs. San Diego Chargers (2/12/2012),2/12/2012,San Diego Chargers,Cornerback,defense,No,Yes,13,2012,1,4.0,No,Head,8,Did not return from injury,21.50 downs
43,Adrian Robinson,Pittsburgh Steelers,Pittsburgh Steelers vs. Cincinnati Bengals (21/10/2012),21/10/2012,Cincinnati Bengals,Linebacker,defense,No,Yes,7,2012,1,0.0,No,Concussion,9,7 downs,3.00 downs
44,Rashean Mathis,Detroit Lions,Detroit Lions vs. Chicago Bears (29/9/2013),29/09/2013,Chicago Bears,Cornerback,defense,No,Yes,4,2013,1,0.0,No,Head,9,68 downs,49.67 downs
45,Nick Kasa,Oakland Raiders,New York Jets vs. Oakland Raiders (8/12/2013),8/12/2013,New York Jets,Tight End,offense,No,No,14,2013,1,0.0,No,Concussion,9,11 downs,7.42 downs
46,Terron Armstead,New Orleans Saints,Dallas Cowboys vs. New Orleans Saints (28/9/2014),28/09/2014,Dallas Cowboys,Offensive Tackle,offense,No,No,4,2014,1,0.0,No,Concussion,9,89 downs,76.33 downs
47,Christopher Conte,Chicago Bears,Carolina Panthers vs. Chicago Bears (5/10/2014),5/10/2014,Carolina Panthers,Safety,defense,No,No,5,2014,1,0.0,No,Concussion,9,26 downs,42.00 downs
48,Michael Hoomanawanui,New England Patriots,New England Patriots vs. Buffalo Bills (30/9/2012),30/09/2012,Buffalo Bills,Tight End,offense,No,Yes,4,2012,1,2.0,No,Concussion,9,20 downs,17.67 downs
49,Phillip Adams,Oakland Raiders,Oakland Raiders vs. Kansas City Chiefs (16/12/2012),16/12/2012,Kansas City Chiefs,Cornerback,defense,No,Yes,15,2012,1,0.0,No,Concussion,10,25 downs,23.77 downs
50,Gino Gradkowski,Baltimore Ravens,Baltimore Ravens vs. Denver Broncos (12/1/2013),12/01/2013,Denver Broncos,Guard,offense,No,Yes,19,2012,1,0.0,No,Head,10,5 downs,11.71 downs
51,Devin Hester,Chicago Bears,Chicago Bears vs. Minnesota Vikings (25/11/2012),25/11/2012,Minnesota Vikings,Wide Receiver,offense,No,Yes,12,2012,1,1.0,No,Concussion,10,61 downs,36.70 downs
52,Kevin Rutland,Jacksonville Jaguars,Jacksonville Jaguars vs. Indianapolis Colts (23/9/2012),23/09/2012,Indianapolis Colts,Cornerback,defense,No,Yes,3,2012,1,2.0,No,Concussion,10,6 downs,19.50 downs
53,Joshua Cribbs,Cleveland Browns,Baltimore Ravens vs. Cleveland Browns (27/9/2012),27/09/2012,Baltimore Ravens,Wide Receiver,offense,No,No,4,2012,1,0.0,No,Head,11,27 downs,23.67 downs
54,Nate Eachus,Kansas City Chiefs,Oakland Raiders vs. Kansas City Chiefs (28/10/2012),28/10/2012,Oakland Raiders,Running Back,offense,No,No,8,2012,1,1.0,No,Head,11,32 downs,28.50 downs
55,Delanie Walker,Tennessee Titans,Indianapolis Colts vs. Tennessee Titans (1/12/2013),1/12/2013,Indianapolis Colts,Tight End,offense,No,No,13,2013,1,1.0,No,Concussion,11,77 downs,54.55 downs
56,Brady Quinn,Kansas City Chiefs,Oakland Raiders vs. Kansas City Chiefs (28/10/2012),28/10/2012,Oakland Raiders,Quarterback,offense,No,No,8,2012,1,2.0,No,Head,11,30 downs,39.00 downs
57,Joe Reitz,Indianapolis Colts,Indianapolis Colts vs. Houston Texans (15/12/2013),15/12/2013,Houston Texans,Guard,offense,No,Yes,15,2013,1,3.0,No,Concussion,11,Did not return from injury,15.17 downs
58,Mike Tolbert,Carolina Panthers,Carolina Panthers vs. Washington Redskins (4/11/2012),4/11/2012,Washington Redskins,Full Back,offense,No,Yes,9,2012,1,0.0,No,Head,12,22 downs,33.00 downs
59,Peyton Hillis,New York Giants,Seattle Seahawks vs. New York Giants (15/12/2013),15/12/2013,Seattle Seahawks,Running Back,offense,No,No,15,2013,1,1.0,No,Concussion,12,41 downs,25.25 downs
60,Bilal Powell,New York Jets,Seattle Seahawks vs. New York Jets (11/11/2012),11/11/2012,Seattle Seahawks,Running Back,offense,No,No,10,2012,1,0.0,No,Concussion,13,28 downs,31.00 downs
61,Anthony Allen,Baltimore Ravens,Baltimore Ravens vs. Denver Broncos (12/1/2013),12/01/2013,Denver Broncos,Running Back,offense,No,Yes,19,2012,1,0.0,No,Head,13,16 downs,24.35 downs
62,Kyle Wilson,New York Jets,Pittsburgh Steelers vs. New York Jets (13/10/2013),13/10/2013,Pittsburgh Steelers,Cornerback,defense,No,No,6,2013,1,0.0,No,Concussion,13,70 downs,54.00 downs
63,Omar Bolden,Denver Broncos,New England Patriots vs. Denver Broncos (24/11/2013),24/11/2013,New England Patriots,Safety,defense,No,No,12,2013,1,0.0,No,Concussion,13,25 downs,22.20 downs
64,Chris Prosinski,Jacksonville Jaguars,Jacksonville Jaguars vs. Houston Texans (5/12/2013),5/12/2013,Houston Texans,Safety,defense,No,Yes,14,2013,1,0.0,No,Concussion,13,82 downs,0.00 downs
65,Joseph Randle,Dallas Cowboys,Dallas Cowboys vs. Tennessee Titans (14/9/2014),14/09/2014,Tennessee Titans,Running Back,offense,No,Yes,2,2014,1,0.0,No,Concussion,13,9 downs,3.00 downs
66,John Sullivan,Minnesota Vikings,Buffalo Bills vs. Minnesota Vikings (19/10/2014),19/10/2014,Buffalo Bills,Center,offense,No,No,7,2014,1,0.0,No,Concussion,13,74 downs,62.57 downs
67,Montell Owens,Jacksonville Jaguars,Jacksonville Jaguars vs. Indianapolis Colts (23/9/2012),23/09/2012,Indianapolis Colts,Running Back,offense,No,Yes,3,2012,1,0.0,No,Concussion,14,18 downs,32.50 downs
68,William Powell,Arizona Cardinals,St. Louis Rams vs. Arizona Cardinals (4/10/2012),4/10/2012,St. Louis Rams,Running Back,offense,No,No,5,2012,1,0.0,No,Head,14,35 downs,40.00 downs
69,Phillip Adams,Oakland Raiders,Cleveland Browns vs. Oakland Raiders (2/12/2012),2/12/2012,Cleveland Browns,Cornerback,defense,No,No,13,2012,1,0.0,No,Concussion,14,61 downs,21.27 downs
70,Mychal Rivera,Oakland Raiders,Tennessee Titans vs. Oakland Raiders (24/11/2013),24/11/2013,Tennessee Titans,Tight End,offense,No,No,12,2013,1,0.0,No,Concussion,14,42 downs,51.50 downs
71,Brodrick Bunkley,New Orleans Saints,Detroit Lions vs. New Orleans Saints (19/10/2014),19/10/2014,Detroit Lions,Defensive Tackle,defense,No,No,7,2014,1,0.0,No,Concussion,14,24 downs,27.50 downs
72,Lamin Barrow,Denver Broncos,Denver Broncos vs. San Diego Chargers (23/10/2014),23/10/2014,San Diego Chargers,Linebacker,defense,No,Yes,8,2014,1,0.0,No,Concussion,14,30 downs,28.50 downs
73,James Harrison,Cincinnati Bengals,Pittsburgh Steelers vs. Cincinnati Bengals (15/12/2013),15/12/2013,Pittsburgh Steelers,Linebacker,defense,No,No,15,2013,1,1.0,No,Concussion,14,27 downs,30.77 downs
74,Martin Tevaseu,Indianapolis Colts,Indianapolis Colts vs. Buffalo Bills (25/11/2012),25/11/2012,Buffalo Bills,Defensive Tackle,defense,No,Yes,12,2012,1,0.0,No,Head,15,24 downs,14.00 downs
75,Ramon Foster,Pittsburgh Steelers,Oakland Raiders vs. Pittsburgh Steelers (27/10/2013),27/10/2013,Oakland Raiders,Guard,offense,No,No,8,2013,1,0.0,No,Concussion,15,80 downs,58.00 downs
76,David Amerson,Washington Redskins,Arizona Cardinals vs. Washington Redskins (12/10/2014),12/10/2014,Arizona Cardinals,Cornerback,defense,No,No,6,2014,1,0.0,No,Concussion,15,59 downs,73.40 downs
77,Christopher Owens,Atlanta Falcons,Atlanta Falcons vs. Denver Broncos (17/9/2012),17/09/2012,Denver Broncos,Cornerback,defense,No,Yes,2,2012,1,2.0,No,Head,15,21 downs,32.00 downs
78,Justin Hunter,Tennessee Titans,Indianapolis Colts vs. Tennessee Titans (14/11/2013),14/11/2013,Indianapolis Colts,Wide Receiver,offense,No,No,11,2013,1,0.0,No,Concussion,16,39 downs,17.13 downs
79,Daren Bates,St. Louis Rams,St. Louis Rams vs. Chicago Bears (24/11/2013),24/11/2013,Chicago Bears,Linebacker,defense,No,Yes,12,2013,1,1.0,No,Concussion,16,17 downs,19.60 downs
80,Jeron Johnson,Seattle Seahawks,Seattle Seahawks vs. Carolina Panthers (26/10/2014),26/10/2014,Carolina Panthers,Safety,defense,No,Yes,8,2014,1,1.0,No,Concussion,16,75 downs,23.67 downs
81,Will Rackley,Jacksonville Jaguars,San Francisco 49ers vs. Jacksonville Jaguars (27/10/2013),27/10/2013,San Francisco 49ers,Guard,offense,No,No,8,2013,1,2.0,No,Concussion,16,72 downs,62.86 downs
82,Bryan Walters,Seattle Seahawks,St. Louis Rams vs. Seattle Seahawks (19/10/2014),19/10/2014,St. Louis Rams,Wide Receiver,offense,No,No,7,2014,1,2.0,No,Concussion,16,10 downs,16.67 downs
83,Rashad Jennings,Jacksonville Jaguars,Buffalo Bills vs. Jacksonville Jaguars (2/12/2012),2/12/2012,Buffalo Bills,Running Back,offense,No,No,13,2012,1,4.0,No,Concussion,16,Did not return from injury,38.33 downs
84,Keith Brooking,Denver Broncos,New England Patriots vs. Denver Broncos (7/10/2012),7/10/2012,New England Patriots,Linebacker,defense,No,No,5,2012,1,0.0,No,Concussion,17,37 downs,33.50 downs
85,Jeff Allen,Kansas City Chiefs,San Diego Chargers vs. Kansas City Chiefs (1/11/2012),1/11/2012,San Diego Chargers,Guard,offense,No,No,9,2012,1,0.0,No,Head,17,68 downs,50.71 downs
86,Matt Giordano,Oakland Raiders,Cleveland Browns vs. Oakland Raiders (2/12/2012),2/12/2012,Cleveland Browns,Safety,defense,No,No,13,2012,1,0.0,No,Concussion,17,87 downs,61.36 downs
87,Vernon Davis,San Francisco 49ers,Seattle Seahawks vs. San Francisco 49ers (23/12/2012),23/12/2012,Seattle Seahawks,Tight End,offense,No,No,16,2012,1,0.0,No,Concussion,17,60 downs,60.07 downs
88,Chris Ogbonnaya,Cleveland Browns,Cleveland Browns vs. Buffalo Bills (3/10/2013),3/10/2013,Buffalo Bills,Running Back,offense,No,Yes,5,2013,1,0.0,No,Concussion,17,55 downs,52.75 downs
89,Andre Fluellen,Detroit Lions,Cincinnati Bengals vs. Detroit Lions (20/10/2013),20/10/2013,Cincinnati Bengals,Defensive Tackle,defense,No,No,7,2013,1,0.0,No,Concussion,17,19 downs,16.33 downs
90,Nate Irving,Denver Broncos,Houston Texans vs. Denver Broncos (23/9/2012),23/09/2012,Houston Texans,Linebacker,defense,No,No,3,2012,1,1.0,No,Concussion,17,24 downs,21.50 downs
91,Garrett Graham,Houston Texans,Houston Texans vs. Tennessee Titans (2/12/2012),2/12/2012,Tennessee Titans,Tight End,offense,No,Yes,13,2012,1,1.0,No,Concussion,17,46 downs,50.27 downs
92,Jabari Greer,New Orleans Saints,New Orleans Saints vs. Dallas Cowboys (23/12/2012),23/12/2012,Dallas Cowboys,Cornerback,defense,No,Yes,16,2012,1,1.0,No,Concussion,17,Did not return from injury,61.85 downs
93,Josh Thomas,Carolina Panthers,Buffalo Bills vs. Carolina Panthers (15/9/2013),15/09/2013,Buffalo Bills,Cornerback,defense,No,No,2,2013,1,1.0,No,Concussion,17,65 downs,71.00 downs
94,Dan Connolly,New England Patriots,New England Patriots vs. New Orleans Saints (13/10/2013),13/10/2013,New Orleans Saints,Guard,offense,No,Yes,6,2013,1,1.0,No,Concussion,17,80 downs,74.80 downs
95,Kevin Boss,Kansas City Chiefs,Buffalo Bills vs. Kansas City Chiefs (16/9/2012),16/09/2012,Buffalo Bills,Tight End,offense,No,No,2,2012,1,14.0,No,Head,17,Did not return from injury,37.00 downs
96,Luke Joeckel,Jacksonville Jaguars,Miami Dolphins vs. Jacksonville Jaguars (26/10/2014),26/10/2014,Miami Dolphins,Offensive Tackle,offense,No,No,8,2014,1,0.0,No,Concussion,18,66 downs,68.14 downs
97,Usama Young,Cleveland Browns,Cleveland Browns vs. Pittsburgh Steelers (25/11/2012),25/11/2012,Pittsburgh Steelers,Safety,defense,No,Yes,12,2012,1,1.0,No,Head,18,28 downs,56.22 downs
98,Da'Quan Bowers,Tampa Bay Buccaneers,Tampa Bay Buccaneers vs. Miami Dolphins (11/11/2013),11/11/2013,Miami Dolphins,Defensive End,defense,No,Yes,10,2013,1,1.0,No,Concussion,18,19 downs,18.50 downs
99,Thomas DeCoud,Atlanta Falcons,Green Bay Packers vs. Atlanta Falcons (8/12/2013),8/12/2013,Green Bay Packers,Safety,defense,No,No,14,2013,1,1.0,No,Concussion,18,66 downs,77.58 downs
100,Josh Norman,Carolina Panthers,Carolina Panthers vs. Chicago Bears (5/10/2014),5/10/2014,Chicago Bears,Cornerback,defense,No,Yes,5,2014,1,2.0,No,Concussion,18,71 downs,32.00 downs
101,Phillip Gaines,Kansas City Chiefs,San Francisco 49ers vs. Kansas City Chiefs (5/10/2014),5/10/2014,San Francisco 49ers,Cornerback,defense,No,No,5,2014,1,0.0,No,Concussion,19,49 downs,14.25 downs
102,Percy Harvin,Seattle Seahawks,Seattle Seahawks vs. New Orleans Saints (11/1/2014),11/01/2014,New Orleans Saints,Wide Receiver,offense,No,Yes,19,2013,1,1.0,No,Concussion,19,31 downs,21.00 downs
103,Marcus Gilbert,Pittsburgh Steelers,Pittsburgh Steelers vs. Houston Texans (20/10/2014),20/10/2014,Houston Texans,Offensive Tackle,offense,No,Yes,7,2014,1,1.0,No,Concussion,19,75 downs,66.71 downs
104,Early Doucet,Arizona Cardinals,Seattle Seahawks vs. Arizona Cardinals (9/12/2012),9/12/2012,Seattle Seahawks,Wide Receiver,offense,No,No,14,2012,1,3.0,No,Concussion,19,Did not return from injury,43.36 downs
105,Dexter McCluster,Kansas City Chiefs,Denver Broncos vs. Kansas City Chiefs (25/11/2012),25/11/2012,Denver Broncos,Wide Receiver,offense,No,No,12,2012,1,0.0,No,Head,20,24 downs,40.00 downs
106,Craig Steltz,Chicago Bears,Chicago Bears vs. Baltimore Ravens (17/11/2013),17/11/2013,Baltimore Ravens,Safety,defense,No,Yes,11,2013,1,0.0,No,Concussion,20,16 downs,19.88 downs
107,LaMar Miller,Miami Dolphins,Miami Dolphins vs. Pittsburgh Steelers (8/12/2013),8/12/2013,Pittsburgh Steelers,Running Back,offense,No,Yes,14,2013,1,0.0,No,Concussion,20,38 downs,40.92 downs
108,Duke Ihenacho,Denver Broncos,Denver Broncos vs. Oakland Raiders (29/12/2013),29/12/2013,Oakland Raiders,Safety,defense,No,Yes,17,2013,1,0.0,No,Concussion,20,45 downs,56.79 downs
109,Brandon Flowers,San Diego Chargers,Kansas City Chiefs vs. San Diego Chargers (19/10/2014),19/10/2014,Kansas City Chiefs,Cornerback,defense,No,No,7,2014,1,1.0,No,Concussion,20,59 downs,54.00 downs
110,Cody Davis,St. Louis Rams,Kansas City Chiefs vs. St. Louis Rams (26/10/2014),26/10/2014,Kansas City Chiefs,Safety,defense,No,No,8,2014,1,1.0,No,Concussion,20,22 downs,21.00 downs
111,Earl Bennett,Chicago Bears,Seattle Seahawks vs. Chicago Bears (2/12/2012),2/12/2012,Seattle Seahawks,Wide Receiver,offense,No,No,13,2012,1,2.0,No,Concussion,20,31 downs,40.89 downs
112,Michael Vick,Philadelphia Eagles,Dallas Cowboys vs. Philadelphia Eagles (11/11/2012),11/11/2012,Dallas Cowboys,Quarterback,offense,No,No,10,2012,1,6.0,No,Concussion,20,60 downs,73.38 downs
113,David Amerson,Washington Redskins,Dallas Cowboys vs. Washington Redskins (13/10/2013),13/10/2013,Dallas Cowboys,Cornerback,defense,No,No,6,2013,1,0.0,No,Concussion,21,32 downs,65.00 downs
114,Dwayne Gratz,Jacksonville Jaguars,San Diego Chargers vs. Jacksonville Jaguars (28/9/2014),28/09/2014,San Diego Chargers,Cornerback,defense,No,No,4,2014,1,1.0,No,Concussion,21,28 downs,84.67 downs
115,Vernon Davis,San Francisco 49ers,Carolina Panthers vs. San Francisco 49ers (10/11/2013),10/11/2013,Carolina Panthers,Tight End,offense,No,No,10,2013,1,0.0,No,Concussion,22,56 downs,46.50 downs
116,Eugene Sims,St. Louis Rams,St. Louis Rams vs. Seattle Seahawks (30/9/2012),30/09/2012,Seattle Seahawks,Defensive End,defense,No,Yes,4,2012,1,1.0,No,Head,22,36 downs,49.33 downs
117,John Carlson,Minnesota Vikings,Minnesota Vikings vs. Arizona Cardinals (21/10/2012),21/10/2012,Arizona Cardinals,Tight End,offense,No,Yes,7,2012,1,2.0,No,Concussion,22,12 downs,22.83 downs
118,Donald Brown,San Diego Chargers,San Diego Chargers vs. New York Jets (5/10/2014),5/10/2014,New York Jets,Linebacker,defense,No,Yes,5,2014,1,3.0,No,Concussion,22,20 downs,43.75 downs
119,Stephen Burton,Jacksonville Jaguars,Jacksonville Jaguars vs. Tennessee Titans (10/11/2013),10/11/2013,Tennessee Titans,Wide Receiver,offense,No,Yes,10,2013,1,7.0,No,Concussion,22,Did not return from injury,45.33 downs
120,Julian Edelman,New England Patriots,New England Patriots vs. New York Jets (22/11/2012),22/11/2012,New York Jets,Wide Receiver,offense,No,Yes,12,2012,1,0.0,No,Concussion,23,59 downs,41.00 downs
121,Jason Snelling,Atlanta Falcons,New York Jets vs. Atlanta Falcons (7/10/2013),7/10/2013,New York Jets,Running Back,offense,No,No,5,2013,1,0.0,No,Concussion,23,28 downs,34.00 downs
122,Reed Doughty,Washington Redskins,Washington Redskins vs. Chicago Bears (20/10/2013),20/10/2013,Chicago Bears,Safety,defense,No,Yes,7,2013,1,1.0,No,Concussion,23,29 downs,46.50 downs
123,Willis McGahee,Cleveland Browns,New England Patriots vs. Cleveland Browns (8/12/2013),8/12/2013,New England Patriots,Running Back,offense,No,No,14,2013,1,1.0,No,Concussion,23,2 downs,24.00 downs
124,Matt Conrath,St. Louis Rams,San Francisco 49ers vs. St. Louis Rams (26/9/2013),26/09/2013,San Francisco 49ers,Defensive Tackle,defense,No,No,4,2013,1,5.0,No,Concussion,23,23 downs,20.00 downs
125,Alex Smith,San Francisco 49ers,St. Louis Rams vs. San Francisco 49ers (11/11/2012),11/11/2012,St. Louis Rams,Quarterback,offense,No,No,10,2012,1,6.0,No,Concussion,23,6 downs,56.88 downs
126,Darcel McBath,San Francisco 49ers,San Francisco 49ers vs. New Orleans Saints (25/11/2012),25/11/2012,New Orleans Saints,Safety,defense,No,Yes,12,2012,1,0.0,No,Concussion,24,20 downs,21.00 downs
127,Zac Stacy,St. Louis Rams,St. Louis Rams vs. Chicago Bears (24/11/2013),24/11/2013,Chicago Bears,Running Back,offense,No,Yes,12,2013,1,0.0,No,Concussion,24,55 downs,36.63 downs
128,Reed Doughty,Washington Redskins,New York Giants vs. Washington Redskins (1/12/2013),1/12/2013,New York Giants,Safety,defense,No,No,13,2013,1,0.0,No,Concussion,24,57 downs,48.80 downs
129,William Gholston,Tampa Bay Buccaneers,Tampa Bay Buccaneers vs. Buffalo Bills (8/12/2013),8/12/2013,Buffalo Bills,Defensive End,defense,No,Yes,14,2013,1,0.0,No,Head,24,42 downs,21.50 downs
130,Chris Culliver,San Francisco 49ers,San Francisco 49ers vs. Dallas Cowboys (7/9/2014),7/09/2014,Dallas Cowboys,Cornerback,defense,No,Yes,1,2014,1,0.0,No,Concussion,24,59 downs,24.00 downs
131,Charlie Peprah,Dallas Cowboys,Dallas Cowboys vs. Cleveland Browns (18/11/2012),18/11/2012,Cleveland Browns,Safety,defense,No,Yes,11,2012,1,0.0,No,Concussion,25,32 downs,55.00 downs
132,Matthew Slater,New England Patriots,New England Patriots vs. New York Jets (22/11/2012),22/11/2012,New York Jets,Wide Receiver,offense,No,Yes,12,2012,1,0.0,No,Concussion,25,20 downs,18.70 downs
133,Will Tukuafu,San Francisco 49ers,San Francisco 49ers vs. New England Patriots (16/12/2012),16/12/2012,New England Patriots,Defensive Tackle,defense,No,Yes,15,2012,1,0.0,No,Concussion,25,13 downs,22.50 downs
