134,Darrell Stuckey,San Diego Chargers,San Diego Chargers vs. Kansas City Chiefs (24/11/2013),24/11/2013,Kansas City Chiefs,Safety,defense,No,Yes,12,2013,1,0.0,No,Concussion,25,19 downs,21.20 downs
135,Niles Paul,Washington Redskins,New York Giants vs. Washington Redskins (25/9/2014),25/09/2014,New York Giants,Tight End,offense,No,No,4,2014,1,0.0,No,Concussion,25,48 downs,62.00 downs
136,Christian Ponder,Minnesota Vikings,Minnesota Vikings vs. Chicago Bears (1/12/2013),1/12/2013,Chicago Bears,Quarterback,offense,No,Yes,13,2013,1,4.0,No,Concussion,25,Did not return from injury,60.75 downs
137,Mike Brisiel,Oakland Raiders,Atlanta Falcons vs. Oakland Raiders (14/10/2012),14/10/2012,Atlanta Falcons,Guard,offense,No,No,6,2012,1,0.0,No,Concussion,26,85 downs,65.50 downs
138,Brian Cushing,Houston Texans,Seattle Seahawks vs. Houston Texans (29/9/2013),29/09/2013,Seattle Seahawks,Linebacker,defense,No,No,4,2013,1,0.0,No,Concussion,26,50 downs,66.00 downs
139,Johnny Patrick,San Diego Chargers,Miami Dolphins vs. San Diego Chargers (17/11/2013),17/11/2013,Miami Dolphins,Cornerback,defense,No,No,11,2013,1,0.0,No,Concussion,26,43 downs,51.00 downs
140,Jay Cutler,Chicago Bears,Houston Texans vs. Chicago Bears (11/11/2012),11/11/2012,Houston Texans,Quarterback,offense,No,No,10,2012,1,1.0,No,Concussion,26,73 downs,63.50 downs
141,Mason Foster,Tampa Bay Buccaneers,Tampa Bay Buccaneers vs. Atlanta Falcons (17/11/2013),17/11/2013,Atlanta Falcons,Linebacker,defense,No,Yes,11,2013,1,1.0,No,Concussion,26,60 downs,56.33 downs
142,Bill Bentley,Detroit Lions,New York Giants vs. Detroit Lions (22/12/2013),22/12/2013,New York Giants,Cornerback,defense,No,No,16,2013,1,1.0,No,Concussion,26,Did not return from injury,47.92 downs
143,Jacquizz Rodgers,Atlanta Falcons,San Francisco 49ers vs. Atlanta Falcons (23/12/2013),23/12/2013,San Francisco 49ers,Running Back,offense,No,No,16,2013,1,1.0,No,Concussion,26,Did not return from injury,40.00 downs
144,Joique Bell,Detroit Lions,Detroit Lions vs. New York Jets (28/9/2014),28/09/2014,New York Jets,Running Back,offense,No,Yes,4,2014,1,2.0,No,Concussion,26,46 downs,38.00 downs
145,Laurent Robinson,Jacksonville Jaguars,Cincinnati Bengals vs. Jacksonville Jaguars (30/9/2012),30/09/2012,Cincinnati Bengals,Wide Receiver,offense,No,No,4,2012,1,3.0,No,Concussion,26,45 downs,39.00 downs
146,Mike Mitchell,Oakland Raiders,Cleveland Browns vs. Oakland Raiders (2/12/2012),2/12/2012,Cleveland Browns,Safety,defense,No,No,13,2012,1,0.0,No,Concussion,27,49 downs,32.00 downs
147,Chris Williams,St. Louis Rams,St. Louis Rams vs. Chicago Bears (24/11/2013),24/11/2013,Chicago Bears,Guard,offense,No,Yes,12,2013,1,0.0,No,Concussion,27,72 downs,62.60 downs
148,Darrius Heyward-Bey,Oakland Raiders,Oakland Raiders vs. Pittsburgh Steelers (23/9/2012),23/09/2012,Pittsburgh Steelers,Wide Receiver,offense,No,Yes,3,2012,1,1.0,No,Concussion,27,50 downs,56.50 downs
149,Ryan Griffin,Houston Texans,Arizona Cardinals vs. Houston Texans (10/11/2013),10/11/2013,Arizona Cardinals,Tight End,offense,No,No,10,2013,1,1.0,No,Concussion,27,33 downs,28.50 downs
150,Dan Connolly,New England Patriots,New England Patriots vs. Buffalo Bills (12/10/2014),12/10/2014,Buffalo Bills,Guard,offense,No,Yes,6,2014,1,1.0,No,Concussion,27,71 downs,72.80 downs
151,Luke Stocker,Tampa Bay Buccaneers,New Orleans Saints vs. Tampa Bay Buccaneers (16/12/2012),16/12/2012,New Orleans Saints,Tight End,offense,No,No,15,2012,1,0.0,No,Head,28,45 downs,38.15 downs
152,Patrick Peterson,Arizona Cardinals,Arizona Cardinals vs. Philadelphia Eagles (26/10/2014),26/10/2014,Philadelphia Eagles,Cornerback,defense,No,Yes,8,2014,1,0.0,No,Concussion,28,68 downs,66.33 downs
153,T.J. Lang,Green Bay Packers,Chicago Bears vs. Green Bay Packers (4/11/2013),4/11/2013,Chicago Bears,Guard,offense,No,No,9,2013,1,0.0,No,Concussion,29,84 downs,77.00 downs
154,Fletcher Cox,Philadelphia Eagles,Washington Redskins vs. Philadelphia Eagles (23/12/2012),23/12/2012,Washington Redskins,Defensive Tackle,defense,No,No,16,2012,1,1.0,No,Concussion,29,Did not return from injury,41.57 downs
155,George Selvie,Jacksonville Jaguars,Buffalo Bills vs. Jacksonville Jaguars (2/12/2012),2/12/2012,Buffalo Bills,Defensive End,defense,No,No,13,2012,1,2.0,No,Concussion,29,30 downs,33.17 downs
156,Jason Hatcher,Dallas Cowboys,Washington Redskins vs. Dallas Cowboys (22/11/2012),22/11/2012,Washington Redskins,Defensive Tackle,defense,No,No,12,2012,1,0.0,No,Concussion,30,54 downs,46.00 downs
157,Keith Tandy,Tampa Bay Buccaneers,Atlanta Falcons vs. Tampa Bay Buccaneers (20/10/2013),20/10/2013,Atlanta Falcons,Safety,defense,No,No,7,2013,1,0.0,No,Concussion,30,43 downs,18.20 downs
158,Kamar Aiken,Baltimore Ravens,Baltimore Ravens vs. Tampa Bay Buccaneers (12/10/2014),12/10/2014,Tampa Bay Buccaneers,Wide Receiver,offense,No,Yes,6,2014,1,0.0,No,Concussion,30,33 downs,18.40 downs
159,Kevin Ogletree,Dallas Cowboys,Dallas Cowboys vs. Cleveland Browns (18/11/2012),18/11/2012,Cleveland Browns,Wide Receiver,offense,No,Yes,11,2012,1,1.0,No,Concussion,30,21 downs,34.56 downs
160,Jeff Cumberland,New York Jets,Cincinnati Bengals vs. New York Jets (27/10/2013),27/10/2013,Cincinnati Bengals,Tight End,offense,No,No,8,2013,1,1.0,No,Concussion,30,51 downs,44.71 downs
161,Clyde Gates,New York Jets,New England Patriots vs. New York Jets (22/11/2012),22/11/2012,New England Patriots,Wide Receiver,offense,No,No,12,2012,1,2.0,No,Concussion,30,17 downs,22.14 downs
162,Jordan Cameron,Cleveland Browns,Washington Redskins vs. Cleveland Browns (16/12/2012),16/12/2012,Washington Redskins,Tight End,offense,No,No,15,2012,1,2.0,No,Head,30,Did not return from injury,29.77 downs
163,Alex Smith,Cleveland Browns,Cincinnati Bengals vs. Cleveland Browns (16/9/2012),16/09/2012,Cincinnati Bengals,Tight End,offense,No,No,2,2012,1,3.0,No,Head,30,14 downs,43.00 downs
164,Melvin White,Carolina Panthers,Carolina Panthers vs. Minnesota Vikings (13/10/2013),13/10/2013,Minnesota Vikings,Cornerback,defense,No,Yes,6,2013,1,0.0,No,Concussion,31,58 downs,28.50 downs
165,Eddie Lacy,Green Bay Packers,Seattle Seahawks vs. Green Bay Packers (4/9/2014),4/09/2014,Seattle Seahawks,Running Back,offense,No,No,1,2014,1,0.0,No,Concussion,31,55 downs,31.00 downs
166,Tony Scheffler,Detroit Lions,Green Bay Packers vs. Detroit Lions (6/10/2013),6/10/2013,Green Bay Packers,Tight End,offense,No,No,5,2013,1,11.0,No,Concussion,31,Did not return from injury,16.25 downs
167,Kendall Wright,Tennessee Titans,Houston Texans vs. Tennessee Titans (15/9/2013),15/09/2013,Houston Texans,Wide Receiver,offense,No,No,2,2013,1,0.0,No,Concussion,32,45 downs,19.00 downs
168,Chris Harris,Denver Broncos,Denver Broncos vs. Dallas Cowboys (6/10/2013),6/10/2013,Dallas Cowboys,Cornerback,defense,No,Yes,5,2013,1,0.0,No,Concussion,32,68 downs,71.00 downs
169,Asa Jackson,Baltimore Ravens,Baltimore Ravens vs. Pittsburgh Steelers (11/9/2014),11/09/2014,Pittsburgh Steelers,Cornerback,defense,No,Yes,2,2014,1,0.0,No,Concussion,32,71 downs,57.00 downs
170,Isa Abdul-Quddus,New Orleans Saints,San Francisco 49ers vs. New Orleans Saints (25/11/2012),25/11/2012,San Francisco 49ers,Safety,defense,No,No,12,2012,1,1.0,No,Concussion,32,86 downs,45.70 downs
171,Tyler Polumbus,Washington Redskins,Washington Redskins vs. Cleveland Browns (16/12/2012),16/12/2012,Cleveland Browns,Offensive Tackle,offense,No,Yes,15,2012,1,1.0,No,Head,32,62 downs,64.77 downs
172,Kenny Vaccaro,New Orleans Saints,New Orleans Saints vs. Dallas Cowboys (10/11/2013),10/11/2013,Dallas Cowboys,Safety,defense,No,Yes,10,2013,1,1.0,No,Concussion,32,68 downs,66.75 downs
173,Phil Taylor,Cleveland Browns,New York Jets vs. Cleveland Browns (22/12/2013),22/12/2013,New York Jets,Offensive Tackle,offense,No,No,16,2013,1,1.0,No,Concussion,32,Did not return from injury,41.86 downs
174,Vontaze Burfict,Cincinnati Bengals,Cincinnati Bengals vs. Atlanta Falcons (14/9/2014),14/09/2014,Atlanta Falcons,Linebacker,defense,No,Yes,2,2014,1,2.0,No,Concussion,32,80 downs,23.00 downs
175,Ryan Clark,Pittsburgh Steelers,Pittsburgh Steelers vs. Washington Redskins (28/10/2012),28/10/2012,Washington Redskins,Safety,defense,No,Yes,8,2012,1,0.0,No,Concussion,33,58 downs,63.40 downs
176,Coty Sensabaugh,Tennessee Titans,Kansas City Chiefs vs. Tennessee Titans (6/10/2013),6/10/2013,Kansas City Chiefs,Cornerback,defense,No,No,5,2013,1,0.0,No,Concussion,33,45 downs,48.00 downs
177,Brandon Boykin,Philadelphia Eagles,Minnesota Vikings vs. Philadelphia Eagles (15/12/2013),15/12/2013,Minnesota Vikings,Cornerback,defense,No,No,15,2013,1,0.0,No,Concussion,33,53 downs,58.85 downs
178,Wallace Gilberry,Cincinnati Bengals,Cincinnati Bengals vs. Baltimore Ravens (29/12/2013),29/12/2013,Baltimore Ravens,Defensive End,defense,No,Yes,17,2013,1,0.0,No,Concussion,33,33 downs,36.13 downs
179,O'Brien Schofield,Seattle Seahawks,Seattle Seahawks vs. Oakland Raiders (2/11/2014),2/11/2014,Oakland Raiders,Defensive End,defense,No,Yes,9,2014,1,0.0,No,Head,33,35 downs,33.89 downs
180,Daniel Thomas,Miami Dolphins,Miami Dolphins vs. Cincinnati Bengals (7/10/2012),7/10/2012,Cincinnati Bengals,Running Back,offense,No,Yes,5,2012,1,1.0,No,Concussion,33,49 downs,36.33 downs
181,Jerel Worthy,Green Bay Packers,Green Bay Packers vs. Jacksonville Jaguars (28/10/2012),28/10/2012,Jacksonville Jaguars,Defensive End,defense,No,Yes,8,2012,1,1.0,No,Concussion,33,22 downs,53.86 downs
182,Uche Nwaneri,Jacksonville Jaguars,New England Patriots vs. Jacksonville Jaguars (23/12/2012),23/12/2012,New England Patriots,Guard,offense,No,No,16,2012,1,1.0,No,Concussion,33,Did not return from injury,66.79 downs
183,Benjamin Watson,New Orleans Saints,New Orleans Saints vs. Dallas Cowboys (10/11/2013),10/11/2013,Dallas Cowboys,Tight End,offense,No,Yes,10,2013,1,1.0,No,Concussion,33,27 downs,40.63 downs
184,Devin McCourty,New England Patriots,New England Patriots vs. Baltimore Ravens (22/12/2013),22/12/2013,Baltimore Ravens,Safety,defense,No,Yes,16,2013,1,1.0,No,Concussion,33,78 downs,84.07 downs
185,Jordan Reed,Washington Redskins,Philadelphia Eagles vs. Washington Redskins (17/11/2013),17/11/2013,Philadelphia Eagles,Tight End,offense,No,No,11,2013,1,6.0,No,Concussion,33,Did not return from injury,48.14 downs
186,Tiquan Underwood,Tampa Bay Buccaneers,Tampa Bay Buccaneers vs. Carolina Panthers (18/11/2012),18/11/2012,Carolina Panthers,Wide Receiver,offense,No,Yes,11,2012,1,0.0,No,Head,34,29 downs,25.86 downs
187,Terence Newman,Cincinnati Bengals,Cincinnati Bengals vs. Kansas City Chiefs (18/11/2012),18/11/2012,Kansas City Chiefs,Cornerback,defense,No,Yes,11,2012,1,0.0,No,Head,34,63 downs,62.00 downs
188,Donnie Avery,Indianapolis Colts,New England Patriots vs. Indianapolis Colts (18/11/2012),18/11/2012,New England Patriots,Wide Receiver,offense,No,No,11,2012,1,0.0,No,Head,34,71 downs,66.44 downs
189,Roy Miller,Tampa Bay Buccaneers,Denver Broncos vs. Tampa Bay Buccaneers (2/12/2012),2/12/2012,Denver Broncos,Defensive Tackle,defense,No,No,13,2012,1,1.0,No,Head,34,29 downs,40.73 downs
190,Sheldon Brown,Cleveland Browns,Denver Broncos vs. Cleveland Browns (23/12/2012),23/12/2012,Denver Broncos,Cornerback,defense,No,No,16,2012,1,1.0,No,Head,34,Did not return from injury,61.21 downs
191,George Iloka,Cincinnati Bengals,Cincinnati Bengals vs. Indianapolis Colts (8/12/2013),8/12/2013,Indianapolis Colts,Safety,defense,No,Yes,14,2013,1,0.0,No,Concussion,35,63 downs,70.00 downs
192,Jason Campbell,Cleveland Browns,Pittsburgh Steelers vs. Cleveland Browns (24/11/2013),24/11/2013,Pittsburgh Steelers,Quarterback,offense,No,No,12,2013,1,1.0,No,Concussion,35,74 downs,51.25 downs
193,Robert Griffin III,Washington Redskins,Atlanta Falcons vs. Washington Redskins (7/10/2012),7/10/2012,Atlanta Falcons,Quarterback,offense,No,No,5,2012,1,0.0,No,Head,36,58 downs,71.00 downs
194,Torrey Smith,Baltimore Ravens,Denver Broncos vs. Baltimore Ravens (16/12/2012),16/12/2012,Denver Broncos,Wide Receiver,offense,No,No,15,2012,1,0.0,No,Head,36,75 downs,60.92 downs
195,Jay Ratliff,Chicago Bears,Chicago Bears vs. San Francisco 49ers (14/9/2014),14/09/2014,San Francisco 49ers,Defensive Tackle,defense,No,Yes,2,2014,1,3.0,No,Concussion,36,41 downs,55.00 downs
196,Will Johnson,Pittsburgh Steelers,Pittsburgh Steelers vs. Baltimore Ravens (2/12/2012),2/12/2012,Baltimore Ravens,Full Back,offense,No,Yes,13,2012,1,0.0,No,Concussion,37,20 downs,34.27 downs
197,Jake Long,St. Louis Rams,San Francisco 49ers vs. St. Louis Rams (1/12/2013),1/12/2013,San Francisco 49ers,Offensive Tackle,offense,No,No,13,2013,1,0.0,No,Concussion,37,56 downs,67.00 downs
198,Jon Baldwin,Kansas City Chiefs,Pittsburgh Steelers vs. Kansas City Chiefs (12/11/2012),12/11/2012,Pittsburgh Steelers,Wide Receiver,offense,No,No,10,2012,1,1.0,No,Head,37,26 downs,39.00 downs
199,Morris Claiborne,Dallas Cowboys,Dallas Cowboys vs. Cincinnati Bengals (9/12/2012),9/12/2012,Cincinnati Bengals,Cornerback,defense,No,Yes,14,2012,1,1.0,No,Concussion,37,93 downs,58.50 downs
200,Joe Reitz,Indianapolis Colts,Indianapolis Colts vs. Houston Texans (30/12/2012),30/12/2012,Houston Texans,Guard,offense,No,Yes,17,2012,1,1.0,No,Concussion,37,Did not return from injury,58.63 downs
201,Johnathan Cyprien,Jacksonville Jaguars,Philadelphia Eagles vs. Jacksonville Jaguars (7/9/2014),7/09/2014,Philadelphia Eagles,Safety,defense,No,No,1,2014,1,1.0,No,Concussion,37,78 downs,37.00 downs
202,Omar Bolden,Denver Broncos,Denver Broncos vs. San Francisco 49ers (19/10/2014),19/10/2014,San Francisco 49ers,Cornerback,defense,No,Yes,7,2014,1,1.0,No,Concussion,37,17 downs,24.33 downs
203,Anthony Fasano,Kansas City Chiefs,Denver Broncos vs. Kansas City Chiefs (1/12/2013),1/12/2013,Denver Broncos,Tight End,offense,No,No,13,2013,1,2.0,No,Concussion,37,53 downs,59.86 downs
204,Eric Reid,San Francisco 49ers,Seattle Seahawks vs. San Francisco 49ers (15/9/2013),15/09/2013,Seattle Seahawks,Safety,defense,No,No,2,2013,1,0.0,No,Concussion,38,77 downs,67.00 downs
205,Jerrell Freeman,Indianapolis Colts,San Diego Chargers vs. Indianapolis Colts (14/10/2013),14/10/2013,San Diego Chargers,Linebacker,defense,No,No,6,2013,1,0.0,No,Concussion,38,78 downs,56.80 downs
206,Corey Liuget,San Diego Chargers,San Diego Chargers vs. Jacksonville Jaguars (28/9/2014),28/09/2014,Jacksonville Jaguars,Defensive End,defense,No,Yes,4,2014,1,0.0,No,Concussion,38,27 downs,46.67 downs
207,Eric Fisher,Kansas City Chiefs,Kansas City Chiefs vs. New York Giants (29/9/2013),29/09/2013,New York Giants,Offensive Tackle,offense,No,Yes,4,2013,1,1.0,No,Concussion,38,67 downs,75.33 downs
208,Phil Loadholt,Minnesota Vikings,Dallas Cowboys vs. Minnesota Vikings (3/11/2013),3/11/2013,Dallas Cowboys,Offensive Tackle,offense,No,No,9,2013,1,1.0,No,Concussion,38,78 downs,65.86 downs
209,Alex Green,Green Bay Packers,Green Bay Packers vs. Chicago Bears (16/12/2012),16/12/2012,Chicago Bears,Running Back,offense,No,Yes,15,2012,1,2.0,No,Concussion,38,1 downs,29.55 downs
210,John Carlson,Minnesota Vikings,Baltimore Ravens vs. Minnesota Vikings (8/12/2013),8/12/2013,Baltimore Ravens,Tight End,offense,No,No,14,2013,1,3.0,No,Concussion,39,Did not return from injury,45.42 downs
211,D'Qwell Jackson,Cleveland Browns,New York Giants vs. Cleveland Browns (7/10/2012),7/10/2012,New York Giants,Linebacker,defense,No,No,5,2012,1,0.0,No,Head,40,75 downs,84.00 downs
212,Joe Staley,San Francisco 49ers,New York Giants vs. San Francisco 49ers (14/10/2012),14/10/2012,New York Giants,Offensive Tackle,offense,No,No,6,2012,1,0.0,No,Concussion,40,61 downs,67.40 downs
213,Barry Richardson,St. Louis Rams,New England Patriots vs. St. Louis Rams (28/10/2012),28/10/2012,New England Patriots,Offensive Tackle,offense,No,No,8,2012,1,0.0,No,Head,40,88 downs,66.14 downs
214,Santana Moss,Washington Redskins,Carolina Panthers vs. Washington Redskins (4/11/2012),4/11/2012,Carolina Panthers,Wide Receiver,offense,No,No,9,2012,1,0.0,No,Head,40,22 downs,28.75 downs
215,Elbert Mack,New Orleans Saints,New Orleans Saints vs. Oakland Raiders (18/11/2012),18/11/2012,Oakland Raiders,Cornerback,defense,No,Yes,11,2012,1,1.0,No,Concussion,40,39 downs,6.00 downs
216,Eric Wright,Tampa Bay Buccaneers,Washington Redskins vs. Tampa Bay Buccaneers (30/9/2012),30/09/2012,Washington Redskins,Cornerback,defense,No,No,4,2012,1,0.0,No,Head,41,68 downs,63.33 downs
217,Lawrence Jackson,Detroit Lions,Indianapolis Colts vs. Detroit Lions (2/12/2012),2/12/2012,Indianapolis Colts,Defensive End,defense,No,No,13,2012,1,0.0,No,Concussion,41,33 downs,28.20 downs
218,Eric Reid,San Francisco 49ers,Carolina Panthers vs. San Francisco 49ers (10/11/2013),10/11/2013,Carolina Panthers,Safety,defense,No,No,10,2013,1,0.0,No,Concussion,41,75 downs,67.75 downs
219,Josh McNary,Indianapolis Colts,Indianapolis Colts vs. Kansas City Chiefs (4/1/2014),4/01/2014,Kansas City Chiefs,Linebacker,defense,No,Yes,18,2013,1,0.0,No,Concussion,41,38 downs,37.60 downs
220,Terrell McClain,Dallas Cowboys,Dallas Cowboys vs. St. Louis Rams (21/9/2014),21/09/2014,St. Louis Rams,Defensive Tackle,defense,No,Yes,3,2014,1,1.0,No,Concussion,41,18 downs,20.00 downs
221,Jeremy Mincey,Jacksonville Jaguars,Indianapolis Colts vs. Jacksonville Jaguars (29/9/2013),29/09/2013,Indianapolis Colts,Defensive End,defense,No,No,4,2013,1,3.0,No,Concussion,41,21 downs,29.67 downs
222,Trumaine Johnson,St. Louis Rams,St. Louis Rams vs. Chicago Bears (24/11/2013),24/11/2013,Chicago Bears,Cornerback,defense,No,Yes,12,2013,1,0.0,No,Concussion,42,65 downs,57.20 downs
223,Vontaze Burfict,Cincinnati Bengals,Cincinnati Bengals vs. Minnesota Vikings (22/12/2013),22/12/2013,Minnesota Vikings,Linebacker,defense,No,Yes,16,2013,1,0.0,No,Concussion,42,69 downs,70.21 downs
224,Fred Jackson,Buffalo Bills,New England Patriots vs. Buffalo Bills (11/11/2012),11/11/2012,New England Patriots,Running Back,offense,No,No,10,2012,1,1.0,No,Concussion,42,32 downs,30.33 downs
225,Drayton Florence,Detroit Lions,Green Bay Packers vs. Detroit Lions (18/11/2012),18/11/2012,Green Bay Packers,Cornerback,defense,No,No,11,2012,1,0.0,No,Concussion,43,84 downs,45.50 downs
226,Antonio Allen,New York Jets,New York Jets vs. New Orleans Saints (3/11/2013),3/11/2013,New Orleans Saints,Safety,defense,No,Yes,9,2013,1,0.0,No,Concussion,43,6 downs,53.13 downs
227,Vance Walker,Oakland Raiders,New York Jets vs. Oakland Raiders (8/12/2013),8/12/2013,New York Jets,Defensive Tackle,defense,No,No,14,2013,1,1.0,No,Concussion,43,60 downs,55.58 downs
228,K'Waun Williams,Cleveland Browns,Cleveland Browns vs. Pittsburgh Steelers (12/10/2014),12/10/2014,Pittsburgh Steelers,Cornerback,defense,No,Yes,6,2014,1,1.0,No,Concussion,43,15 downs,26.80 downs
229,Jordan Pugh,Washington Redskins,Washington Redskins vs. Minnesota Vikings (14/10/2012),14/10/2012,Minnesota Vikings,Safety,defense,No,Yes,6,2012,1,0.0,No,Head,44,43 downs,12.50 downs
230,Arthur Jones,Baltimore Ravens,New England Patriots vs. Baltimore Ravens (22/12/2013),22/12/2013,New England Patriots,Defensive Tackle,defense,No,No,16,2013,1,1.0,No,Concussion,44,Did not return from injury,41.00 downs
231,Jason Pinkston,Cleveland Browns,New York Jets vs. Cleveland Browns (22/12/2013),22/12/2013,New York Jets,Guard,offense,No,No,16,2013,1,1.0,No,Concussion,44,Did not return from injury,60.00 downs
232,Mike Iupati,San Francisco 49ers,San Francisco 49ers vs. St. Louis Rams (13/10/2014),13/10/2014,St. Louis Rams,Guard,offense,No,Yes,6,2014,1,1.0,No,Concussion,44,71 downs,73.40 downs
233,Red Bryant,Seattle Seahawks,Seattle Seahawks vs. Tampa Bay Buccaneers (3/11/2013),3/11/2013,Tampa Bay Buccaneers,Defensive End,defense,No,Yes,9,2013,1,1.0,No,Concussion,45,39 downs,35.50 downs
234,Rashad Jennings,Oakland Raiders,Dallas Cowboys vs. Oakland Raiders (28/11/2013),28/11/2013,Dallas Cowboys,Running Back,offense,No,No,13,2013,1,1.0,No,Concussion,46,62 downs,43.27 downs
235,Vince Williams,Pittsburgh Steelers,New England Patriots vs. Pittsburgh Steelers (3/11/2013),3/11/2013,New England Patriots,Linebacker,defense,No,No,9,2013,1,0.0,No,Concussion,47,33 downs,43.00 downs
236,Ramses Barden,New York Giants,Philadelphia Eagles vs. New York Giants (30/9/2012),30/09/2012,Philadelphia Eagles,Wide Receiver,offense,No,No,4,2012,1,1.0,No,Concussion,47,13 downs,42.33 downs
237,Jarvis Jones,Pittsburgh Steelers,Pittsburgh Steelers vs. New York Jets (13/10/2013),13/10/2013,New York Jets,Linebacker,defense,No,Yes,6,2013,1,1.0,No,Concussion,47,14 downs,57.25 downs
238,Max Unger,Seattle Seahawks,Seattle Seahawks vs. Tampa Bay Buccaneers (3/11/2013),3/11/2013,Tampa Bay Buccaneers,Center,offense,No,Yes,9,2013,1,1.0,No,Concussion,47,45 downs,64.17 downs
239,Brandon Bostick,Green Bay Packers,Minnesota Vikings vs. Green Bay Packers (24/11/2013),24/11/2013,Minnesota Vikings,Tight End,offense,No,No,12,2013,1,1.0,No,Concussion,47,26 downs,26.88 downs
240,Scott Chandler,Buffalo Bills,New England Patriots vs. Buffalo Bills (30/9/2012),30/09/2012,New England Patriots,Tight End,offense,No,No,4,2012,1,0.0,No,Head,48,43 downs,59.33 downs
241,Javier Arenas,Kansas City Chiefs,San Diego Chargers vs. Kansas City Chiefs (1/11/2012),1/11/2012,San Diego Chargers,Cornerback,defense,No,No,9,2012,1,0.0,No,Head,48,72 downs,32.86 downs
242,Kyle Rudolph,Minnesota Vikings,Chicago Bears vs. Minnesota Vikings (25/11/2012),25/11/2012,Chicago Bears,Tight End,offense,No,No,12,2012,1,0.0,No,Concussion,48,47 downs,63.20 downs
243,Tony Moeaki,Kansas City Chiefs,Oakland Raiders vs. Kansas City Chiefs (16/12/2012),16/12/2012,Oakland Raiders,Tight End,offense,No,No,15,2012,1,1.0,No,Head,48,36 downs,63.31 downs
244,Garrett Graham,Houston Texans,Houston Texans vs. Cincinnati Bengals (5/1/2013),5/01/2013,Cincinnati Bengals,Tight End,offense,No,Yes,18,2012,1,0.0,No,Concussion,49,46 downs,46.40 downs
245,George Selvie,Dallas Cowboys,San Diego Chargers vs. Dallas Cowboys (29/9/2013),29/09/2013,San Diego Chargers,Defensive End,defense,No,No,4,2013,1,0.0,No,Concussion,49,66 downs,46.33 downs
246,Danny Amendola,New England Patriots,New England Patriots vs. New Orleans Saints (13/10/2013),13/10/2013,New Orleans Saints,Wide Receiver,offense,No,Yes,6,2013,1,1.0,No,Concussion,49,38 downs,47.50 downs
247,Chaz Schilens,New York Jets,New England Patriots vs. New York Jets (22/11/2012),22/11/2012,New England Patriots,Wide Receiver,offense,No,No,12,2012,1,0.0,No,Concussion,50,43 downs,44.40 downs
248,Alex Smith,Cincinnati Bengals,Cincinnati Bengals vs. Minnesota Vikings (22/12/2013),22/12/2013,Minnesota Vikings,Tight End,offense,No,Yes,16,2013,1,0.0,No,Concussion,50,37 downs,31.14 downs
249,Terrelle Pryor,Oakland Raiders,Denver Broncos vs. Oakland Raiders (23/9/2013),23/09/2013,Denver Broncos,Quarterback,offense,No,No,3,2013,1,1.0,No,Concussion,50,58 downs,63.00 downs
250,Andre Brown,New York Giants,New York Giants vs. Detroit Lions (22/12/2013),22/12/2013,Detroit Lions,Running Back,offense,No,Yes,16,2013,1,1.0,No,Concussion,50,28 downs,47.00 downs
251,Stephen Burton,Jacksonville Jaguars,Seattle Seahawks vs. Jacksonville Jaguars (22/9/2013),22/09/2013,Seattle Seahawks,Wide Receiver,offense,No,No,3,2013,1,5.0,No,Concussion,50,22 downs,43.00 downs
252,Donald Jones,Buffalo Bills,New England Patriots vs. Buffalo Bills (30/9/2012),30/09/2012,New England Patriots,Wide Receiver,offense,No,No,4,2012,1,0.0,No,Head,51,45 downs,59.00 downs
253,Wes Welker,Denver Broncos,Denver Broncos vs. Tennessee Titans (8/12/2013),8/12/2013,Tennessee Titans,Wide Receiver,offense,No,Yes,14,2013,1,3.0,No,Concussion,51,68 downs,61.25 downs
254,Craig Dahl,St. Louis Rams,St. Louis Rams vs. Buffalo Bills (9/12/2012),9/12/2012,Buffalo Bills,Safety,defense,No,Yes,14,2012,1,0.0,No,Head,52,75 downs,81.42 downs
255,Mychal Kendricks,Philadelphia Eagles,Washington Redskins vs. Philadelphia Eagles (23/12/2012),23/12/2012,Washington Redskins,Linebacker,defense,No,No,16,2012,1,1.0,No,Concussion,52,Did not return from injury,62.79 downs
256,Jordan Cameron,Cleveland Browns,Chicago Bears vs. Cleveland Browns (15/12/2013),15/12/2013,Chicago Bears,Tight End,offense,No,No,15,2013,1,1.0,No,Concussion,52,39 downs,67.69 downs
257,Nate Solder,New England Patriots,Miami Dolphins vs. New England Patriots (15/12/2013),15/12/2013,Miami Dolphins,Offensive Tackle,offense,No,No,15,2013,1,1.0,No,Concussion,52,81 downs,79.46 downs
258,Dwayne Bowe,Kansas City Chiefs,Indianapolis Colts vs. Kansas City Chiefs (22/12/2013),22/12/2013,Indianapolis Colts,Wide Receiver,offense,No,No,16,2013,1,1.0,No,Concussion,52,71 downs,56.07 downs
259,Harrison Smith,Minnesota Vikings,Chicago Bears vs. Minnesota Vikings (25/11/2012),25/11/2012,Chicago Bears,Safety,defense,No,No,12,2012,1,0.0,No,Concussion,53,92 downs,72.50 downs
260,LeSean McCoy,Philadelphia Eagles,Washington Redskins vs. Philadelphia Eagles (18/11/2012),18/11/2012,Washington Redskins,Running Back,offense,No,No,11,2012,1,4.0,No,Concussion,53,64 downs,60.00 downs
261,Amari Spievey,Detroit Lions,Chicago Bears vs. Detroit Lions (22/10/2012),22/10/2012,Chicago Bears,Safety,defense,No,No,7,2012,1,10.0,No,Concussion,53,Did not return from injury,53.25 downs
262,Craig Stevens,Tennessee Titans,Tennessee Titans vs. Buffalo Bills (21/10/2012),21/10/2012,Buffalo Bills,Tight End,offense,No,Yes,7,2012,1,0.0,No,Concussion,54,53 downs,47.00 downs
263,Billy Bajema,Baltimore Ravens,Cincinnati Bengals vs. Baltimore Ravens (30/12/2012),30/12/2012,Cincinnati Bengals,Tight End,offense,No,No,17,2012,1,0.0,No,Head,54,10 downs,22.29 downs
264,Cecil Shorts,Jacksonville Jaguars,Buffalo Bills vs. Jacksonville Jaguars (2/12/2012),2/12/2012,Buffalo Bills,Wide Receiver,offense,No,No,13,2012,1,1.0,No,Concussion,54,62 downs,42.82 downs
265,Brandon Myers,Oakland Raiders,Oakland Raiders vs. Pittsburgh Steelers (23/9/2012),23/09/2012,Pittsburgh Steelers,Tight End,offense,No,Yes,3,2012,1,0.0,No,Concussion,55,67 downs,68.00 downs
266,Josh Wilson,Washington Redskins,St. Louis Rams vs. Washington Redskins (16/9/2012),16/09/2012,St. Louis Rams,Cornerback,defense,No,No,2,2012,1,0.0,No,Head,56,70 downs,80.00 downs
267,Shawn Lauvao,Cleveland Browns,Washington Redskins vs. Cleveland Browns (16/12/2012),16/12/2012,Washington Redskins,Guard,offense,No,No,15,2012,1,0.0,No,Head,56,66 downs,69.54 downs
